input;category
Tuberculose do sistema nervoso;tuberculose
tuberculose neurologica;tuberculose
tuberculose no cerebro;tuberculose
Tuberculose Cerebral;tuberculose
neurotuberculose;tuberculose
o que é neurotuberculose;tuberculose
Tuberculose do sistema nervoso central (TBSNC);tuberculose
Tuberculose Cerebral - Como tratar;tuberculose
Tuberculose Cerebral - diagnostico;tuberculose
Tuberculose Cerebral - principais sintomas;tuberculose
é preciso que uma pessoa com tuberculose pulmonar ou na garganta fale, espirre ou tussa;tuberculose
como se transmite a tuberculose;tuberculose
Como se da o contagio da tuberculose;tuberculose
como se da a transmissão da tuberculose;tuberculose
como é contagio da tuberculose;tuberculose
quais são os meios de transmissão da tuberculose;tuberculose
tuberculose é transmitida por;tuberculose
como pega tuberculose;tuberculose
como eu posso ser contaminado por tuberculose;tuberculose
tiberculose Como é transmitida;tuberculose
como e transmitida a tuberculose;tuberculose
o contágio com esta doença é mais frequente quando se está perto de uma pessoa com tuberculose;tuberculose
como é a transmissão da tuberculose para as pessoas;tuberculose
O contágio com a tuberculose acontece através do ar;tuberculose
o bacilo fica presente no ar quando a pessoa com tuberculose pulmonar ou na garganta fale;tuberculose
tuberculose fica no ar quando o tuberculoso fala espirra ou tosse;tuberculose
pega quando se respira o ar contaminado com o bacilo de Koch;tuberculose
o contágio com esta doença é mais comum quando se está perto da pessoa com tuberculose;tuberculose
impedir a contaminação pelo bacilo de Koch;tuberculose
a vacina impede a contaminação pelo bacilo de Koch;tuberculose
a vacina previne contra tuberculose;tuberculose
como me prevenir da tuberculose;tuberculose
como me proteger do contagio de tuberculose;tuberculose
Como prevenir tuberculose;tuberculose
como me precaver da tuberculose;tuberculose
existe prevenção para a tuberculose;tuberculose
como me proteger da tuberculose;tuberculose
qual a prevenção para tuberculose;tuberculose
que fatores de risco geram aumento do contagio da tuberculose;tuberculose
quero saber os fatores de risco para a tuberculose;tuberculose
que fatores são de risco para a tuberculose;tuberculose
Tuberculose - Fatores de Risco;tuberculose
quais os fatores de risco para a tuberculose;tuberculose
quais os riscos de contrair tuberculose;tuberculose
existe fatores que aumentam o risco de contaminação por tuberculose;tuberculose
o que aumenta o risco de contrair tuberculose;tuberculose
quais os riscos para a tuberculose;tuberculose
quais são os fatores de risco da tuberculose;tuberculose
a tuberculose pode acometer os gânglios do tórax, virilha, abdômen ou pescoço.;tuberculose
tuberculose nos ganglios;tuberculose
o que é tuberculose ganglionar;tuberculose
Tuberculose ganglionar;tuberculose
a tuberculose ganglionar atinge o sistema linfático;tuberculose
preciso saber sobre tuberculose ganglionar;tuberculose
tuberculose nos ganglios linfaticos;tuberculose
fala sobre tuberculose ganglionar;tuberculose
quero saber sobre tuberculose ganglionar;tuberculose
preciso de informação sobre tuberculose ganglionar;tuberculose
me explica sobre tuberculose ganglionar;tuberculose
defina tuberculose ganglionar;tuberculose
Tuberculose Ganglionar - Como tratar;tuberculose
Tuberculose Ganglinar - Diagnóstico;tuberculose
Tuberculose Ganglionar - principais sintomas;tuberculose
Tuberculose Intenstinal - Como Tratar;tuberculose
beber leite de animais contaminados causa tuberculose de intestino;tuberculose
comer carne de animais contaminados causa tuberculose de intestino;tuberculose
comer carne ou beber leite de animais contaminados causa tuberculose de intestino;tuberculose
tuberculose nos intestinos;tuberculose
tuberculose instestinal o que é;tuberculose
fala-me sobre tuberculose intestinal;tuberculose
existe tuberculose intestinal;tuberculose
o que é tuberculose intestinal;tuberculose
Tuberculose intestinal;tuberculose
quando a pessoa está com a tuberculose pulmonar e engole a as secreções com o bacilo pega tuberculose intestinal;tuberculose
quando a pessoa está com a tuberculose pulmonar e engole a as secreções pode desenvolver tuberculose intestinal;tuberculose
Tuberculose Intestinal - Diagnostico;tuberculose
tuberculose intestinal - principais sintomas;tuberculose
tuberculose da miningite;tuberculose
o que é Tuberculose miliar ou meníngea;tuberculose
defina Tuberculose miliar ou meníngea;tuberculose
Tuberculose miliar ou meníngea o que é;tuberculose
tipo de tuberculose em que as bactérias estão disseminadas na corrente sanguínea;tuberculose
tuberculose miliar as bactérias estão disseminadas na corrente sanguínea;tuberculose
A tuberculose miliar é uma das formas mais graves da doença.;tuberculose
tuberculose miliar;tuberculose
tuberculose meningea;tuberculose
Tuberculose miliar ou meníngea;tuberculose
a tuberculose miliar provoca lesões em vários tecidos e órgãos do corpo;tuberculose
Tuberculose Miliar - Como tratar;tuberculose
Tuberculose Miliar - Diagnostico;tuberculose
Tuberculose Miliar - principais sintomas;tuberculose
explique tuberculose ocular;tuberculose
Tuberculose ocular;tuberculose
o que é tuberculose ocular;tuberculose
quero saber sobre tuberculose nos olhos;tuberculose
o que é tuberculose oftalmologica;tuberculose
quero saber sobre tuberculose ocular;tuberculose
o que é tuberculose nos olhos;tuberculose
existe tuberculose no olho;tuberculose
existe tuberculose nos olhos;tuberculose
tem tuberculose no globo ocular;tuberculose
como chama a tuberculose nos olhos;tuberculose
defina-me tuberculose ocular;tuberculose
tem tuberculose ocular;tuberculose
Tuberculose ocular - como tratar;tuberculose
Tuberculose Ocular - Diagnostico;tuberculose
Tuberculose Ocular - Principais Sintomas;tuberculose
diga me o que é tuberculose;tuberculose
tuberculose é uma infecççao perigosa;tuberculose
tuberculose é uma infecção grave;tuberculose
tuberculose é uma doença grave;tuberculose
o que é o mal da tuberculose;tuberculose
tuberculose é uma doença bacteriana por uma bactéria;tuberculose
tuberculose o que é;tuberculose
diga-me o que é tuberculose;tuberculose
defina-me tuberculose;tuberculose
doença tuberculose;tuberculose
o que é tuberculose;tuberculose
tuberculose;tuberculose
tuberculose é?;tuberculose
aperto de mao transmite tuberculose;tuberculose
Tuberculose - O que não transmite tuberculose;tuberculose
Compartilhar de comida ou bebida transmite tuberculose;tuberculose
tuberculose não passa atraves de beijo;tuberculose
beijos também não causam transmissão da doenç;tuberculose
não passa traves de roupa da pessoa infectada;tuberculose
tuberculose não passa atraves de utensilhos;tuberculose
tuberculose não passa atraves de comida;tuberculose
tuberculose não passa atraves de aperto de mão;tuberculose
tuberculose não passa atraves de abraço;tuberculose
Usar roupa da pessoa infectada transmite tuberculose;tuberculose
tuberculose da no osso;tuberculose
tuberculose pega no osso;tuberculose
terbeculose da infecção no osso;tuberculose
tuberculose infecciona o osso;tuberculose
o bacilo da tuberculose pode alojar no osso;tuberculose
quero saber sobre tuberculose nos ossos;tuberculose
nossa ossatura pode ter tuberculose;tuberculose
os ossos podem ter tuberculose;tuberculose
os ossos podem ser acometidos de tuberculose;tuberculose
tuberculose pega nos ossos do corpo;tuberculose
Tuberculose ossea;tuberculose
o que é tuberculose ossea;tuberculose
tuberculose no osso;tuberculose
Tuberculose Ossea - como tratar;tuberculose
Tuberculose Ossea - Diagnostico;tuberculose
Option: tuberculose Óssea - principais sintomas;tuberculose
Tuberculose pleural:;tuberculose
como chama a tuberculose no tecido que reveste os pulmões;tuberculose
uso corticoides posso desenvolver tuberculose pleural;tuberculose
pega tuberculose na pleura;tuberculose
a tuberculose pode contagiar a pleura;tuberculose
preciso de orientação sobre tuberculose pleural;tuberculose
o que é a tuberculose pleural;tuberculose
existe tuberculose pleural;tuberculose
tuberculose pega na pleura;tuberculose
a pleura pode ser contaminada pela tuberculose;tuberculose
esclareça-me sobre a tuberculose pleural;tuberculose
me explique a tuberculose pleural;tuberculose
Tuberculose Pleural - Como Tratar;tuberculose
Tuberculose Pleural - Diagnostico;tuberculose
Tuberculose pleural - principais sintomas;tuberculose
tuberculose nos pulmoes;tuberculose
tuberculose no pulmão;tuberculose
pulmão com tuberculose;tuberculose
tuberculose pulmonar ocorre devido a entrada do bacilo nas vias respiratórias;tuberculose
o que é tuberculose pulmonar;tuberculose
forma mais comum da doença é a tuberculose pulmonar;tuberculose
preciso de informações sobre a tuberculose pulmonar;tuberculose
tuberculose pulmonar o que é;tuberculose
quando as bacterias alojam nos pulmões da tuberculose pulmonar;tuberculose
explique-me sobre bacterias pulmonar;tuberculose
esclareça sobre a tuberculose pulmonar;tuberculose
estou com tuberculose pulmonar e quero saber mais;tuberculose
quero saber sobre tuberculose pulmonar;tuberculose
preciso de informação sobre tuberculose pulmonar;tuberculose
defina tuberculose pulmonar;tuberculose
Tuberculose Pulmonar - Como Tratar;tuberculose
Tuberculose Pulmonar - Diagnostico;tuberculose
Tuberculose pulmonar - principais sintomas;tuberculose
tem como sarar da tuberculose;tuberculose
Tuberculose tem cura;tuberculose
existe cura para tuberculose;tuberculose
vou ficar curado da tuberculose;tuberculose
posso ser curado de tuberculose;tuberculose
a cura da tuberculose;tuberculose
tuberculoso pode ser curado;tuberculose
vou sarar da tuberculose;tuberculose
o tratamento da tuberculose deixa o paciente curado;tuberculose
o paciente de tuberculose pode ser curado;tuberculose
o doente de tuberculose pode ser curado;tuberculose
a doença de tuberculose tem cura;tuberculose
existe cura pra doença de tuberculose;tuberculose
a doença de tuberculose ja tem cura;tuberculose
existe quantos tipos de tuberculose;tuberculose
Tuberculose tipos;tuberculose
tipos de tuberculose;tuberculose
quais são os tipos de tuberculose;tuberculose
tipos de tuberculose mais comuns;tuberculose
quero saber quais os tipos de tuberculose;tuberculose
me fale quais os tipos de tuberculose;tuberculose
existem quantos tipos de tuberculose;tuberculose
quais os tipos de tuberculose existem;tuberculose
Tuberculose Tratamento Gratuito;tuberculose
quem arca com o custo do tratamento de tuberculose;tuberculose
sou tuberculoso e não tenho dinheiro para pagar o tratamento;tuberculose
estou com tuberculose vou ter que pagar o tratamento;tuberculose
o SUS paga o tratamento de tuberculose;tuberculose
o Ministerio da saude paga o tratamento de tuberculose;tuberculose
o governo paga o tratamento de tuberculose;tuberculose
quanto custa o tratamento de tuberculose;tuberculose
as despesas de remedio para tuberculose quem paga;tuberculose
eu pago o tratamento de tuberculose;tuberculose
o que é a tuberculose urinaria;tuberculose
quero saber sobre tuberculose urinaria;tuberculose
preciso saber sobre tuberculose urinaria;tuberculose
que é a tuberculose dos rins;tuberculose
quero informação sobre tuberculose urinaria;tuberculose
tuberculose da bexiga;tuberculose
me fale sobre a tuberculose urinaria;tuberculose
Tuberculose Urinaria;tuberculose
tuberculose urinaria é o que;tuberculose
defina tuberculose urinaria;tuberculose
esclareça sobre tuberculose urinaria;tuberculose
fala-me da tuberculose urinaria;tuberculose
me diz sobre a tuberculose urinaria;tuberculose
o que é a tuberculose do aparelho urinario;tuberculose
o que é essa doença tuberculose urinaria;tuberculose
Tuberculose Urinaria - Como tratar;tuberculose
Tuberculose Urinaria - Diagnostico;tuberculose
Tuberculose Urinaria - principais sintomas;tuberculose
o que fazer estou tuberculoso;tuberculose
como agir se eu estiver com tuberculose;tuberculose
Minha oximetria está baixa pode ser tuberculose;tuberculose
Estou com sintoma de tuberculose, o que faço?;tuberculose
se eu estiver tuberculoso o que devo fazer;tuberculose
Se eu ficar doente de tuberculose o que fazer?;tuberculose
Estou me sentindo gripado e acho que é tuberculose, o que faço?;tuberculose
estou tuberculoso e quero uma orientação;tuberculose
qual a orientação a seguir no caso de tuberculose;tuberculose
o que fazer se descobrir que esta com tuberculose;tuberculose